{
  "mode":"partner_search","question":"合成示例：比较用户已提供的两个候选，不认定命定配偶",
  "self":{"birth":{"calendar":"solar","date":"1996-06-15","time":"12:00","gender":"male","timezone":"Asia/Shanghai"}},
  "as_of":"2026-10-06","search":{"type":"people","people":[
    {"id":"candidate-a","birth":{"calendar":"solar","date":"1997-06-01","time":"09:00","gender":"female","timezone":"Asia/Shanghai"}},
    {"id":"candidate-b","birth":{"calendar":"solar","date":"1995-03-10","time":"18:00","gender":"male","timezone":"Asia/Shanghai"}}
  ]},"partner_star_model":"all"
}
