{
  "mode":"partner_search","question":"合成示例：明确小范围假设生辰逐一排盘匹配",
  "self":{"birth":{"calendar":"solar","date":"1996-06-15","time":"12:00","gender":"male","timezone":"Asia/Shanghai"}},
  "as_of":"2026-10-06","search":{"type":"dates","start":"1997-06-01","end":"1997-06-02","timezone":"Asia/Shanghai","time_uncertainty":{"type":"candidates","times":["09:00","23:30"]}},
  "filters":{"conditions":["zodiac_affinity","spouse_branch_liuhe","day_stem_five_combine","partner_star_projection"],"match":"any","year_gap":[-12,12]}
}
